{
  "$schema": "../_schema/adapter.schema.json",
  "vendor": "codex",
  "version": "1.0.0",
  "output_paths": {
    "base": ".",
    "skills": ".agents/skills"
  },
  "section_mappings": [
    {
      "agents_md_heading": "## Git Conventions",
      "output_file": "AGENTS.md",
      "activation_mode": "passthrough",
      "frontmatter": {}
    },
    {
      "agents_md_heading": "## Security",
      "output_file": "AGENTS.md",
      "activation_mode": "passthrough",
      "frontmatter": {}
    },
    {
      "agents_md_heading": "## Code Review",
      "output_file": "AGENTS.md",
      "activation_mode": "passthrough",
      "frontmatter": {}
    },
    {
      "agents_md_heading": "## Testing Philosophy",
      "output_file": "AGENTS.md",
      "activation_mode": "passthrough",
      "frontmatter": {}
    },
    {
      "agents_md_heading": "## Documentation",
      "output_file": "AGENTS.md",
      "activation_mode": "passthrough",
      "frontmatter": {}
    }
  ],
  "unsupported_sections": [],
  "character_limit_per_file": null,
  "total_character_limit": null,
  "notes": "OpenAI Codex reads AGENTS.md natively and hierarchically (root + subdirectory AGENTS.md files are merged). This adapter is a passthrough — the composed AGENTS.md is the output. Skills are deployed canonically to .agentic/skills/ and symlinked to .agents/skills/ per OpenAI specification. Codex supports placing AGENTS.md in subdirectories for monorepo scoping."
}
