{
  "$schema": "../_schema/adapter.schema.json",
  "vendor": "gemini",
  "version": "2.0.0",
  "output_paths": {
    "base": ".",
    "skills": ".gemini/skills"
  },
  "section_mappings": [
    { "agents_md_heading": "## Git Conventions", "output_file": "GEMINI.md", "activation_mode": "always-on", "frontmatter": {} },
    { "agents_md_heading": "## Security",         "output_file": "GEMINI.md", "activation_mode": "always-on", "frontmatter": {} },
    { "agents_md_heading": "## Code Review",      "output_file": "GEMINI.md", "activation_mode": "always-on", "frontmatter": {} },
    { "agents_md_heading": "## Testing Philosophy","output_file": "GEMINI.md", "activation_mode": "always-on", "frontmatter": {} },
    { "agents_md_heading": "## Documentation",    "output_file": "GEMINI.md", "activation_mode": "always-on", "frontmatter": {} },
    { "agents_md_heading": "## TypeScript",       "output_file": "GEMINI.md", "activation_mode": "always-on", "frontmatter": {} },
    { "agents_md_heading": "## Go",               "output_file": "GEMINI.md", "activation_mode": "always-on", "frontmatter": {} },
    { "agents_md_heading": "## Python",           "output_file": "GEMINI.md", "activation_mode": "always-on", "frontmatter": {} },
    { "agents_md_heading": "## PHP",              "output_file": "GEMINI.md", "activation_mode": "always-on", "frontmatter": {} }
  ],
  "unsupported_sections": [],
  "character_limit_per_file": null,
  "total_character_limit": null,
  "notes": "Gemini CLI auto-discovers GEMINI.md at the project root (zero config). .gemini/system.md is used as a full system-prompt override when GEMINI_SYSTEM_MD=1 is set. Skills are deployed natively to .gemini/skills/ and activated lazily via the activate_skill tool."
}